{"architecture_identity":{"approved_class_names":["smart-home__section","smart-home__stage--relative"],"approved_class_names_unchanged":true,"architect_forbidden_work_weakened":false,"architect_unknowns_preserved":true,"build_tree_identity_preserved":true,"review_unit_traces":[{"architect_evidence_refs":["ev-tree"],"architect_node_ref":"node-root","ce_review_unit_id":"node-root","identity_unchanged":true},{"architect_evidence_refs":["ev-tree"],"architect_node_ref":"node-wrapper","ce_review_unit_id":"node-wrapper","identity_unchanged":true}],"selected_candidate_id":"ARCH-FAM-C","selected_candidate_id_unchanged":true,"selected_candidate_locked":true},"boundary_assertions":{"ce_did_not_claim_builder_execution":true,"ce_did_not_claim_responsive_completion":true,"ce_did_not_redesign_architecture":true,"production_ready":false},"builder_executable_package":{"approved_class_names":["smart-home__section","smart-home__stage--relative"],"approved_class_names_unchanged":true,"architect_contract":{"approved_class_names":["smart-home__section","smart-home__stage--relative"],"selected_candidate_id":"ARCH-FAM-C","source_ref":"synthetic-intermediate-bundle-001"},"blocking_dependencies":[],"builder_decisions_required":0,"builder_package_status":"executable_ready","confirmation_request":{"confirmation_id":"CONFIRM-INTERMEDIATE-001","confirmed_action_ids":["BATCH-INTERMEDIATE-001-A01"],"expected_user_token":"تایید BATCH-INTERMEDIATE-001"},"first_safe_builder_batch":{"actions":[{"action_id":"BATCH-INTERMEDIATE-001-A01","action_type":"preserve_structure","parameters":{"strategy_map_ref":"ISM-INTERMEDIATE-001"},"requires_decision":false,"target_node":"node-root"}],"batch_id":"BATCH-INTERMEDIATE-001","risk":"low"},"package_id":"BEP-INTERMEDIATE-001","qa_status":{"production_ready":false},"review_ref":"CRR-INTERMEDIATE-001","schema":"ev4-builder-executable-package@1.0.0","selected_candidate_id":"ARCH-FAM-C","selected_candidate_id_unchanged":true,"selected_candidate_locked":true,"strategy_map_ref":"ISM-INTERMEDIATE-001"},"builder_package_emitted":true,"builder_package_not_emitted_reason":null,"constructability_review":{"approved_class_names":["smart-home__section","smart-home__stage--relative"],"architect_package_ref":"synthetic-intermediate-bundle-001","architect_unknowns":[],"blocking_dependencies":[],"builder_decisions_required":0,"constructability_status":"executable_ready","preserved_forbidden_work":["no_invent_assets","no_invent_breakpoints","no_invent_geometry","no_claim_builder_ready"],"review_id":"CRR-INTERMEDIATE-001","reviewed_nodes":[{"action_proposed":"preserve approved section root","architect_evidence_refs":["ev-tree"],"architect_node_ref":"node-root","blocking_reason":null,"interrogation_result":{"accessibility_claimed":false,"accessibility_evidenced":null,"action_targets_responsive":false,"architect_decomposition_permission":false,"asset_required":false,"asset_source_present":null,"dynamic_loop_approved":null,"dynamic_loop_implied":false,"exact_ui_control_path_used":false,"geometry_proven":null,"geometry_required":false,"interaction_approved":null,"interaction_implied":false,"overlay_strategy_proven":null,"overlay_strategy_required":false,"placeholder_policy_present":null,"requires_class_change":false,"requires_structure_change":false,"responsive_behavior":"not_applicable","reversible_if_wrong":true,"ui_control_evidence_present":null},"node_id":"node-root","node_status":"executable_ready","node_type":"section_root","review_unit_id":"node-root"},{"action_proposed":"preserve approved grouping wrapper","architect_evidence_refs":["ev-tree"],"architect_node_ref":"node-wrapper","blocking_reason":null,"interrogation_result":{"accessibility_claimed":false,"accessibility_evidenced":null,"action_targets_responsive":false,"architect_decomposition_permission":false,"asset_required":false,"asset_source_present":null,"dynamic_loop_approved":null,"dynamic_loop_implied":false,"exact_ui_control_path_used":false,"geometry_proven":null,"geometry_required":false,"interaction_approved":null,"interaction_implied":false,"overlay_strategy_proven":null,"overlay_strategy_required":false,"placeholder_policy_present":null,"requires_class_change":false,"requires_structure_change":false,"responsive_behavior":"not_applicable","reversible_if_wrong":true,"ui_control_evidence_present":null},"node_id":"node-wrapper","node_status":"executable_ready","node_type":"wrapper","review_unit_id":"node-wrapper"}],"selected_candidate_id":"ARCH-FAM-C"},"evidence_register":[{"description":"Synthetic Build Tree evidence for contract tests.","id":"ev-tree","kind":"architect_tree_identity","source":{"fixture":"source-bundle.json"},"state":"synthetic"}],"extension_records":[],"implementation_strategy_map":{"review_ref":"CRR-INTERMEDIATE-001","selected_candidate_id":"ARCH-FAM-C","strategies":[{"alternatives_considered":[],"architect_amendment_required":false,"builder_decisions_required":0,"class_names_affected":["smart-home__section"],"evidence_source":"architect_package","node_id":"node-root","rationale":"Approved structure is directly implementable.","strategy_id":"STR-NODE-ROOT","strategy_selected":"preserve_section_root","structure_change_required":false},{"alternatives_considered":[],"architect_amendment_required":false,"builder_decisions_required":0,"class_names_affected":["smart-home__stage--relative"],"evidence_source":"architect_package","node_id":"node-wrapper","rationale":"Approved wrapper is directly implementable.","strategy_id":"STR-NODE-WRAPPER","strategy_selected":"preserve_grouping_wrapper","structure_change_required":false}],"strategy_map_id":"ISM-INTERMEDIATE-001"},"owner_repository":"rezahh107/EV4-Constructability-Engineer-Repo","payload_identity":{"payload_id":"ce-payload-intermediate-001","pipeline_id":"ev4-ce-project-gate-producer-pipeline","run_id":"ce-intermediate-fixture-001","synthetic":true},"payload_status":"complete","repair_routing":{},"schema_id":"ev4-ce-stage-payload@1.0.0","schema_version":"1.0.0","source_architect_intake":{"artifact_hash":{"algorithm":"sha256","scope":"canonical_json","value":"f8cede7b74b6d14b33004c26ed4eae267c1167cdc490d2ec960ed5b3e15a994b"},"artifact_ref":"fixtures/intermediate-carriers/valid/minimal-complete/architect-intake.json","schema_id":"ev4-ce-architect-stage-intake@1.1.0","schema_version":"1.1.0","transition_metadata_is_review_evidence":false},"unresolved_evidence":[],"validation_contract":{"intermediate_carriers":"ev4-ce-intermediate-validation-carriers@1.0.0"}}
